{
    "@context": {
        "schema": "http://schema.org/",
        "ex": "https://example.org/",
        "xsd": "http://www.w3.org/2001/XMLSchema#",
        "dcterms": "http://purl.org/dc/terms/",
        "dcat": "http://www.w3.org/ns/dcat#"
    },
    "@id": "ex:baseDiscovery23578",
    "@type": [
        "schema:Dataset"
    ],
    "schema:name": "Bathymetry Bay of Biscay",
    "schema:identifier": "https://doi.org/23566/aslry",
    "schema:url": "https://example.org/landingPage254266",
    "schema:dateModified": "2022-12-12",
    "schema:license": [
        "https://creativecommons.org/publicdomain/zero/1.0/"
    ],
    "schema:subjectOf": {
        "@type": [
            "schema:Dataset"
        ],
        "schema:additionalType": [
            "dcat:CatalogRecord"
        ],
        "@id": "ex:URIforMetadata3575",
        "schema:about": {
            "@id": "ex:baseDiscovery23578"
        },
        "dcterms:conformsTo": [
            {
                "@id": "https://w3id.org/cdif/bbr/metadata/cdifProperties/cdifMandatory"
            },
            {
                "@id": "https://w3id.org/cdif/core/1.0/"
            }
        ],
        "schema:maintainer": {
            "@id": "https://orcid.org/3333-4442-9456-9347",
            "@type": "schema:Person",
            "schema:name": "Goodge, Alice",
            "schema:alternateName": "Metadata curator",
            "schema:contactPoint": {
                "@id": "ex:aContactPoint",
                "@type": "schema:ContactPoint",
                "schema:email": "goodgea@bwc.org"
            },
            "schema:identifier": {
                "@id": "ex:maintainerIdentifier",
                "@type": "schema:PropertyValue",
                "schema:propertyID": "https://registry.identifiers.org/registry/orcid",
                "schema:url": "https://orcid.org/3333-4442-9456-9347"
            }
        },
        "schema:sdDatePublished": "2025-10-24",
        "schema:includedInDataCatalog": {
            "@id": "https://ror.org/04sfkyrt24",
            "@type": "schema:DataCatalog",
            "schema:name": "Global Wildlife Aggregator",
            "schema:url": "http://example.com/wildlifecatalog"
        }
    }
}
